<?xml version="1.0" encoding="UTF-8"?>
<contrato xmlns:xsi="http://www.w3.org/2001/XMLSchema-instance" xsi:noNamespaceSchemaLocation="file:///C:/Users/1DAM01/Documents/SergioMartinez/DAMGit/LENGUAJE/EJERCICIOS/XML.ESQUEMAS/ENTREGAS/ESQUEMAS%20XML%20I/4.xsd">

<clausula>
<epigrafe>
<desarrollo></desarrollo>
</epigrafe>
<epigrafe>
<desarrollo></desarrollo>
<desarrollo></desarrollo>
</epigrafe>
<epilogo></epilogo>
</clausula>

<clausula>
<epigrafe>
<desarrollo></desarrollo>
<desarrollo></desarrollo>
<desarrollo></desarrollo>
</epigrafe>
<epilogo></epilogo>
</clausula>

</contrato>